{
  "corpus_version": "1",
  "fixture_crypto": {
    "ed25519_prefix_hex": "13",
    "ed25519_signature_bytes": 64,
    "ml_dsa_65_prefix_hex": "31",
    "ml_dsa_65_signature_bytes": 3309,
    "scheme": "sha256-prefix-repeat-v1"
  },
  "negative": [
    {
      "bytes_hex": "",
      "class": "malformed_cbor",
      "expected_category": "malformed_cbor",
      "id": "malformed-cbor",
      "input_type": "manifest_cbor",
      "sha256": "e3b0c44298fc1c149afbf4c8996fb92427ae41e4649b934ca495991b7852b855"
    },
    {
      "bytes_hex": "ab646b65797382a6657573616765816772656c65617365666b65795f69646972656c656173652d31667374617475736661637469766569616c676f726974686d67656432353531396e7075626c69635f6b65795f757269781d2f2e77656c6c2d6b6e6f776e2f6b6579732f656432353531392e70656d717075626c69635f6b65795f736861323536784037666536343732386631613762623863366331303366343963306532656430653939393637383232393235366337616162383133363334636336633835626139a6657573616765816772656c65617365666b65795f69646972656c656173652d31667374617475736661637469766569616c676f726974686d696d6c2d6473612d36356e7075626c69635f6b65795f757269781f2f2e77656c6c2d6b6e6f776e2f6b6579732f6d6c2d6473612d36352e70656d717075626c69635f6b65795f736861323536784038356163663531626637323630626337303039663162336436623861346636643034343262663231656139316138366665376362623238326564623331376362677375626a6563747368747470733a2f2f6578616d706c652e636f6d686f70657261746f72a1646e616d65744578616d706c65204f7267616e697a6174696f6e6961727469666163747380696b65795f65706f6368016a657870697265735f617474323032372d30372d32315430303a30303a30305a6a757064617465645f617474323032362d30372d32315430303a30303a30305a6b656e7669726f6e6d656e746a70726f64756374696f6e6c6361706162696c6974696573a2686f7074696f6e616c806872657175697265648467636f72652e76316b6964656e746974792e76316f7472616e73706172656e63792e76316b7265636f766572792e76316c746677735f76657273696f6e63332e30707369676e61747572655f706f6c696379a269706f6c6963795f696477746677732e6879627269642e626173656c696e652e76317372657175697265645f616c676f726974686d73826765643235353139696d6c2d6473612d36",
      "class": "truncated_cbor",
      "expected_category": "malformed_cbor",
      "id": "truncated-cbor",
      "input_type": "manifest_cbor",
      "sha256": "35a37e3483e88d195e16b650992aa09dcf6edcae13b8f62e3223b7a219993157"
    },
    {
      "bytes_hex": "b800",
      "class": "noncanonical_cbor",
      "expected_category": "non_deterministic_cbor",
      "id": "noncanonical-cbor",
      "input_type": "manifest_cbor",
      "sha256": "40d26cb6ec247525c28d5e9512a8de50bd100bba35b98b521171536436e70307"
    },
    {
      "bytes_hex": "a2616101616102",
      "class": "duplicate_key",
      "expected_category": "non_deterministic_cbor",
      "id": "duplicate-key-cbor",
      "input_type": "manifest_cbor",
      "sha256": "a1ba48ece6f0b8d1f923c6877447b05e05b8fbba65be9f1ee2e9817af34a0526"
    },
    {
      "bytes_hex": "d862845845a303756170706c69636174696f6e2f746677732b63626f721078276170706c69636174696f6e2f636f73653b20636f73652d747970653d22636f73652d7369676e221863f5a05902fcab646b65797382a6657573616765816772656c65617365666b65795f69646972656c656173652d31667374617475736661637469766569616c676f726974686d67656432353531396e7075626c69635f6b65795f757269781d2f2e77656c6c2d6b6e6f776e2f6b6579732f656432353531392e70656d717075626c69635f6b65795f736861323536784037666536343732386631613762623863366331303366343963306532656430653939393637383232393235366337616162383133363334636336633835626139a6657573616765816772656c65617365666b65795f69646972656c656173652d31667374617475736661637469766569616c676f726974686d696d6c2d6473612d36356e7075626c69635f6b65795f757269781f2f2e77656c6c2d6b6e6f776e2f6b6579732f6d6c2d6473612d36352e70656d717075626c69635f6b65795f736861323536784038356163663531626637323630626337303039663162336436623861346636643034343262663231656139316138366665376362623238326564623331376362677375626a6563747368747470733a2f2f6578616d706c652e636f6d686f70657261746f72a1646e616d65744578616d706c65204f7267616e697a6174696f6e6961727469666163747380696b65795f65706f6368016a657870697265735f617474323032372d30372d32315430303a30303a30305a6a757064617465645f617474323032362d30372d32315430303a30303a30305a6b656e7669726f6e6d656e746a70726f64756374696f6e6c6361706162696c6974696573a2686f7074696f6e616c806872657175697265648467636f72652e76316b6964656e746974792e76316f7472616e73706172656e63792e76316b7265636f766572792e76316c746677735f76657273696f6e63332e30707369676e61747572655f706f6c696379a269706f6c6963795f696477746677732e6879627269642e626173656c696e652e76317372657175697265645f616c676f726974686d73826765643235353139696d6c2d6473612d363582834ea20132044972656c656173652d31a05840d5c2dbb03c9298ceeaa09f472bc1769a0c7af8f066614b9cec0601310f50aaddd5c2dbb03c9298ceeaa09f472bc1769a0c7af8f066614b9cec0601310f50aadd834fa2013830044972656c656173652d31a0590ceda8a3958bb17df47263090fc04e9dd0872dc601fb4abba769486e5919848b61d1a8a3958bb17df47263090fc04e9dd0872dc601fb4abba769486e5919848b61d1a8a3958bb17df47263090fc04e9dd0872dc601fb4abba769486e5919848b61d1a8a3958bb17df47263090fc04e9dd0872dc601fb4abba769486e5919848b61d1a8a3958bb17df47263090fc04e9dd0872dc601fb4abba769486e5919848b61d1a8a3958bb17df47263090fc04e9dd0872dc601fb4abba769486e5919848b61d1a8a3958bb17df47263090fc04e9dd0872dc601fb4abba769486e5919848b61d1a8a3958bb17df47263090fc04e9dd0872dc601fb4abba769486e5919848b61d1a8a3958bb17df47263090fc04e9dd0872dc601fb4abba769486e5919848b61d1a8a3958bb17df47263090fc04e9dd0872dc601fb4abba769486e5919848b61d1a8a3958bb17df47263090fc04e9dd0872dc601fb4abba769486e5919848b61d1a8a3958bb17df47263090fc04e9dd0872dc601fb4abba769486e5919848b61d1a8a3958bb17df47263090fc04e9dd0872dc601fb4abba769486e5919848b61d1a8a3958bb17df47263090fc04e9dd0872dc601fb4abba769486e5919848b61d1a8a3958bb17df47263090fc04e9dd0872dc601fb4abba769486e5919848b61d1a8a3958bb17df47263090fc04e9dd0872dc601fb4abba769486e5919848b61d1a8a3958bb17df47263090fc04e9dd0872dc601fb4abba769486e5919848b61d1a8a3958bb17df47263090fc04e9dd0872dc601fb4abba769486e5919848b61d1a8a3958bb17df47263090fc04e9dd0872dc601fb4abba769486e5919848b61d1a8a3958bb17df47263090fc04e9dd0872dc601fb4abba769486e5919848b61d1a8a3958bb17df47263090fc04e9dd0872dc601fb4abba769486e5919848b61d1a8a3958bb17df47263090fc04e9dd0872dc601fb4abba769486e5919848b61d1a8a3958bb17df47263090fc04e9dd0872dc601fb4abba769486e5919848b61d1a8a3958bb17df47263090fc04e9dd0872dc601fb4abba769486e5919848b61d1a8a3958bb17df47263090fc04e9dd0872dc601fb4abba769486e5919848b61d1a8a3958bb17df47263090fc04e9dd0872dc601fb4abba769486e5919848b61d1a8a3958bb17df47263090fc04e9dd0872dc601fb4abba769486e5919848b61d1a8a3958bb17df47263090fc04e9dd0872dc601fb4abba769486e5919848b61d1a8a3958bb17df47263090fc04e9dd0872dc601fb4abba769486e5919848b61d1a8a3958bb17df47263090fc04e9dd0872dc601fb4abba769486e5919848b61d1a8a3958bb17df47263090fc04e9dd0872dc601fb4abba769486e5919848b61d1a8a3958bb17df47263090fc04e9dd0872dc601fb4abba769486e5919848b61d1a8a3958bb17df47263090fc04e9dd0872dc601fb4abba769486e5919848b61d1a8a3958bb17df47263090fc04e9dd0872dc601fb4abba769486e5919848b61d1a8a3958bb17df47263090fc04e9dd0872dc601fb4abba769486e5919848b61d1a8a3958bb17df47263090fc04e9dd0872dc601fb4abba769486e5919848b61d1a8a3958bb17df47263090fc04e9dd0872dc601fb4abba769486e5919848b61d1a8a3958bb17df47263090fc04e9dd0872dc601fb4abba769486e5919848b61d1a8a3958bb17df47263090fc04e9dd0872dc601fb4abba769486e5919848b61d1a8a3958bb17df47263090fc04e9dd0872dc601fb4abba769486e5919848b61d1a8a3958bb17df47263090fc04e9dd0872dc601fb4abba769486e5919848b61d1a8a3958bb17df47263090fc04e9dd0872dc601fb4abba769486e5919848b61d1a8a3958bb17df47263090fc04e9dd0872dc601fb4abba769486e5919848b61d1a8a3958bb17df47263090fc04e9dd0872dc601fb4abba769486e5919848b61d1a8a3958bb17df47263090fc04e9dd0872dc601fb4abba769486e5919848b61d1a8a3958bb17df47263090fc04e9dd0872dc601fb4abba769486e5919848b61d1a8a3958bb17df47263090fc04e9dd0872dc601fb4abba769486e5919848b61d1a8a3958bb17df47263090fc04e9dd0872dc601fb4abba769486e5919848b61d1a8a3958bb17df47263090fc04e9dd0872dc601fb4abba769486e5919848b61d1a8a3958bb17df47263090fc04e9dd0872dc601fb4abba769486e5919848b61d1a8a3958bb17df47263090fc04e9dd0872dc601fb4abba769486e5919848b61d1a8a3958bb17df47263090fc04e9dd0872dc601fb4abba769486e5919848b61d1a8a3958bb17df47263090fc04e9dd0872dc601fb4abba769486e5919848b61d1a8a3958bb17df47263090fc04e9dd0872dc601fb4abba769486e5919848b61d1a8a3958bb17df47263090fc04e9dd0872dc601fb4abba769486e5919848b61d1a8a3958bb17df47263090fc04e9dd0872dc601fb4abba769486e5919848b61d1a8a3958bb17df47263090fc04e9dd0872dc601fb4abba769486e5919848b61d1a8a3958bb17df47263090fc04e9dd0872dc601fb4abba769486e5919848b61d1a8a3958bb17df47263090fc04e9dd0872dc601fb4abba769486e5919848b61d1a8a3958bb17df47263090fc04e9dd0872dc601fb4abba769486e5919848b61d1a8a3958bb17df47263090fc04e9dd0872dc601fb4abba769486e5919848b61d1a8a3958bb17df47263090fc04e9dd0872dc601fb4abba769486e5919848b61d1a8a3958bb17df47263090fc04e9dd0872dc601fb4abba769486e5919848b61d1a8a3958bb17df47263090fc04e9dd0872dc601fb4abba769486e5919848b61d1a8a3958bb17df47263090fc04e9dd0872dc601fb4abba769486e5919848b61d1a8a3958bb17df47263090fc04e9dd0872dc601fb4abba769486e5919848b61d1a8a3958bb17df47263090fc04e9dd0872dc601fb4abba769486e5919848b61d1a8a3958bb17df47263090fc04e9dd0872dc601fb4abba769486e5919848b61d1a8a3958bb17df47263090fc04e9dd0872dc601fb4abba769486e5919848b61d1a8a3958bb17df47263090fc04e9dd0872dc601fb4abba769486e5919848b61d1a8a3958bb17df47263090fc04e9dd0872dc601fb4abba769486e5919848b61d1a8a3958bb17df47263090fc04e9dd0872dc601fb4abba769486e5919848b61d1a8a3958bb17df47263090fc04e9dd0872dc601fb4abba769486e5919848b61d1a8a3958bb17df47263090fc04e9dd0872dc601fb4abba769486e5919848b61d1a8a3958bb17df47263090fc04e9dd0872dc601fb4abba769486e5919848b61d1a8a3958bb17df47263090fc04e9dd0872dc601fb4abba769486e5919848b61d1a8a3958bb17df47263090fc04e9dd0872dc601fb4abba769486e5919848b61d1a8a3958bb17df47263090fc04e9dd0872dc601fb4abba769486e5919848b61d1a8a3958bb17df47263090fc04e9dd0872dc601fb4abba769486e5919848b61d1a8a3958bb17df47263090fc04e9dd0872dc601fb4abba769486e5919848b61d1a8a3958bb17df47263090fc04e9dd0872dc601fb4abba769486e5919848b61d1a8a3958bb17df47263090